{
  "schema_version": "d0-v1",
  "request_id": "APR-fixture0001",
  "case_id": "CASE-fixture0001",
  "expected_revision": 1,
  "action_id": "ACTION-fixture0001",
  "action_type": "QUARANTINE_FILE",
  "target_ref": {
    "schema_version": "target-ref-v1",
    "kind": "FILE",
    "observed": {
      "path": "C:\\samples\\fixture.exe"
    },
    "identity_strength": "PARTIAL",
    "verified_digest": {
      "algorithm": "sha256",
      "value": "aaaaaaaaaaaaaaaaaaaaaaaaaaaaaaaaaaaaaaaaaaaaaaaaaaaaaaaaaaaaaaaa"
    },
    "snapshot": {
      "size_bytes": 1024,
      "mtime_ns": 123456789
    },
    "revalidation_required": true
  },
  "effect_summary": "Move file to controlled quarantine after fresh verification",
  "risk": "HIGH",
  "reason": "Analyst review required",
  "expires_at": "2026-10-23T10:05:00Z",
  "requested_at": "2026-10-23T10:00:00Z",
  "status": "PENDING"
}
